question,answer
What is the purpose of the experiment?,"To determine the concentration of vitamin C (ascorbic acid) in a solution using a redox titration with iodine."
What is the role of iodine in the titration?,"Iodine acts as the oxidizing agent, oxidizing ascorbic acid to dehydroascorbic acid while being reduced to iodide ions."
What is the endpoint of the titration?,"The endpoint is marked by the formation of a blue-black starch-iodine complex, indicating all ascorbic acid has been oxidized."
Why is starch used as an indicator?,"Starch forms a blue-black complex with iodine, providing a clear visual endpoint for the titration."
What is the reaction between ascorbic acid and iodine?,"Ascorbic acid + I₂ → 2I⁻ + Dehydroascorbic acid."
What safety precautions should be taken during the experiment?,"Wear a lab coat, safety glasses, and enclosed footwear. Handle iodine carefully as it stains skin and clothing."
How is the iodine solution prepared?,"Dissolve 2 g of potassium iodide and 1.32 g of iodine in a few mL of distilled water, then dilute to 1 L with distilled water."
How is the starch indicator solution prepared?,"Dissolve 0.25 g of soluble starch in 50 mL of near-boiling water, then cool before use."
What is the ideal titre volume range for the titration?,"The ideal titre volume is 10–30 mL. Adjust aliquot size or dilute the sample if outside this range."
How can oxidation of ascorbic acid be minimized?,"Prepare samples immediately before titration or add 1 g of oxalic acid per 100 mL of sample solution."
What is the significance of vitamin C in the human body?,"Vitamin C is a water-soluble antioxidant essential for immune function and disease prevention. It must be obtained from dietary sources."
What is the alternative method to determine iodine concentration?,"Titrate the iodine solution with a standard solution of ascorbic acid or potassium thiosulfate using a starch indicator."
How is the sample prepared for vitamin C tablets?,"Dissolve a single tablet in 200 mL of distilled water, preferably in a volumetric flask."
How is the sample prepared for fresh fruit juice?,"Strain the juice through cheesecloth to remove seeds and pulp that may block pipettes."
How is the sample prepared for solid fruits and vegetables?,"Grind 100 g of the sample with distilled water, strain through cheesecloth, and dilute to 100 mL in a volumetric flask."
What is the role of oxalic acid in the experiment?,"Oxalic acid minimizes the oxidation of ascorbic acid in samples prepared several hours before titration."
What is the chemical structure of ascorbic acid?,"Ascorbic acid has the formula C₆H₈O₆ and contains hydroxyl groups that act as reducing agents."
What is the redox half-equation for ascorbic acid?,"Ascorbic acid → Dehydroascorbic acid + 2H⁺ + 2e⁻."
Why is the iodine solution standardized?,"Iodine solutions are unstable, so standardization with ascorbic acid or potassium thiosulfate ensures accuracy."
What is the concentration of the iodine solution used?,"The iodine solution used is 0.005 mol/L."
What is the concentration of the starch indicator solution?,"The starch indicator solution is 0.5%."
What is the purpose of adding distilled water to the sample before titration?,"Distilled water dilutes the sample, making it easier to observe the endpoint and ensuring proper reaction conditions."
What is the significance of the blue-black color at the endpoint?,"The blue-black color indicates the formation of the starch-iodine complex, signaling that all ascorbic acid has been oxidized."
What should be done if the titre volume is too low?,"Dilute the standard iodine solution to bring the titre volume within the ideal range (10–30 mL)."
What should be done if the titre volume is too high?,"Dilute the sample solution to bring the titre volume within the ideal range (10–30 mL)."
What is the molecular weight of ascorbic acid?,"The molecular weight of ascorbic acid is 176.12 g/mol."
What is the molecular weight of iodine?,"The molecular weight of iodine (I₂) is 253.8 g/mol."
What is the molecular weight of potassium iodide?,"The molecular weight of potassium iodide (KI) is 166.0 g/mol."
What is the role of potassium iodide in the iodine solution?,"Potassium iodide helps dissolve iodine in water by forming the triiodide ion (I₃⁻), which stabilizes the iodine solution."
What is the alternative method to this titration?,"The alternative method uses potassium iodate as a primary standard, which is more stable than iodine."
What is the advantage of using potassium iodate over iodine?,"Potassium iodate solutions are more stable and reliable as primary standards compared to iodine solutions."
What is the disadvantage of using iodine in the titration?,"Iodine solutions are less stable and may require frequent standardization."
What is the purpose of grinding fruits and vegetables for sample preparation?,"Grinding breaks down the cell walls, releasing ascorbic acid into the solution for accurate measurement."
What is the purpose of straining the sample through cheesecloth?,"Straining removes solid particles (e.g., seeds, pulp) that could interfere with pipetting or titration."
What is the role of the burette in the experiment?,"The burette is used to accurately measure and dispense the iodine solution during titration."
What is the role of the conical flask in the experiment?,"The conical flask holds the sample solution and allows for easy mixing during titration."
What is the purpose of cooling the starch solution before use?,"Cooling ensures the starch solution is stable and does not degrade before use."
What is the purpose of rinsing the beaker when preparing the iodine solution?,"Rinsing ensures all traces of iodine and potassium iodide are transferred to the volumetric flask for accurate concentration."
What is the purpose of using a volumetric flask?,"A volumetric flask ensures precise dilution of solutions to the desired volume."
What is the purpose of using a pipette in the experiment?,"A pipette accurately measures and transfers aliquots of the sample solution for titration."
What is the purpose of using a measuring cylinder?,"A measuring cylinder measures approximate volumes of liquids, such as distilled water for dilution."
What is the purpose of using a mortar and pestle?,"A mortar and pestle is used to grind solid fruits and vegetables to extract ascorbic acid."
What is the purpose of using a food processor in sample preparation?,"A food processor blends fruits/vegetables with water to extract ascorbic acid efficiently."
What is the purpose of using a centrifuge in the experiment?,"A centrifuge is not used in this experiment. It is mentioned in other contexts but not here."
What is the purpose of using a watch glass?,"A watch glass is used to dry crystals or hold small amounts of solid samples."
What is the purpose of using a clay plate?,"A clay plate is used to dry crystals or hold small amounts of solid samples."
What is the purpose of using a Hirsch funnel?,"A Hirsch funnel is used for vacuum filtration to collect solid products."
What is the purpose of using a Craig tube?,"A Craig tube is used for microscale crystallization to purify solid products."
What is the purpose of using a micro-spatula?,"A micro-spatula is used to handle small amounts of solid samples or induce crystallization."
What is the purpose of using a glass stirring rod?,"A glass stirring rod is used to mix solutions or induce crystallization by scratching the flask."
What is the purpose of using a magnet in the experiment?,"A magnet is used to remove a magnetic spin vane from the reaction mixture."
What is the purpose of using a spin vane?,"A spin vane is used to stir the reaction mixture during heating or mixing."
What is the purpose of using an air condenser?,"An air condenser prevents the loss of volatile components during heating."
What is the purpose of using an aluminum block or sand bath?,"An aluminum block or sand bath provides even heating for the reaction mixture."
What is the purpose of using a fume hood?,"A fume hood protects against harmful vapors, such as those from acetic anhydride or iodine."
What is the purpose of using a balance?,"A balance is used to accurately weigh chemicals, such as potassium iodide and iodine."
What is the purpose of using a hot plate?,"A hot plate is used to heat solutions, such as the starch indicator solution."
What is the purpose of using a centrifuge tube?,"A centrifuge tube is used to balance the Craig tube during centrifugation."
What is the purpose of using a smooth paper?,"Smooth paper is used to collect and dry crystals after centrifugation."
What is the purpose of using a labeled vial?,"A labeled vial is used to store and submit the final product for evaluation."
What is the purpose of using a notebook?,"A notebook is used to record observations, calculations, and results during the experiment."