Front,Back
"<b>Topic: র‍্যাপিড রুরাল অ্যাপ্রাইজাল (Rapid Rural Appraisal - RRA)</b><br><br><b>Probable Exam Questions [2-5 Marks]:</b><br>1. <b>What:</b> Define Rapid Rural Appraisal (RRA).<br>2. <b>Why:</b> Why was RRA developed as an alternative to formal surveys?<br>3. <b>How:</b> Describe the team composition for RRA.","<b>সহজ ব্যাখ্যা (Simple Explanation):</b><br>RRA হলো গ্রামের মানুষের জীবন সম্পর্কে দ্রুত কিন্তু গভীরভাবে জানার একটি পদ্ধতি। এটি প্রথাগত সার্ভের মতো সময়সাপেক্ষ বা ব্যয়বহুল নয়। এতে বিভিন্ন পেশার মানুষ (Multidisciplinary Team) মিলে গ্রামে গিয়ে সরাসরি মানুষের সাথে কথা বলে তথ্য নেয়।<br><br><b>First Principles Thinking:</b><br>প্রথাগত সার্ভেতে অনেক সময় ও টাকা লাগে &#8594; এবং অনেক সময় ভুল তথ্য আসে &#8594; তাই দ্রুত ও সঠিক তথ্যের জন্য সরাসরি মাঠে গিয়ে কথা বলা (RRA) বেশি কার্যকর।<br><br><b>Analogy (Bizarreness Effect):</b><br>RRA হলো ""হেলিকপ্টার ভিউ"" থেকে গ্রামে নামার মতো। আপনি সার্ভে ফরমের পাহাড় না বানিয়ে, সরাসরি গ্রামের চায়ের দোকানে বসে গল্প করে (Interview) আসল খবর জেনে নেন।<br><br><b>Example:</b><br>কৃষি ফলন কেন কম হচ্ছে তা জানতে কৃষিবিদ ও সমাজবিজ্ঞানী মিলে গ্রামে গিয়ে কৃষকদের সাথে কথা বলা।<br><br><b>See–Link–Animate:</b><br>একজন ডাক্তার, একজন ইঞ্জিনিয়ার এবং একজন সমাজকর্মী গোল হয়ে বসে গ্রামের কৃষকদের সাথে গল্প করছেন এবং নোট নিচ্ছেন।"
"<b>Topic: খাদ্য ও পুষ্টি নজরদারি ব্যবস্থা (Food & Nutrition Surveillance System)</b><br><br><b>Probable Exam Questions [2-5 Marks]:</b><br>1. <b>What:</b> What is the overall goal of a Nutrition Surveillance System?<br>2. <b>Why:</b> Why is it described as a tool for policy-making?<br>3. <b>List:</b> List three immediate objectives of this system.","<b>সহজ ব্যাখ্যা (Simple Explanation):</b><br>এটি এমন একটি ব্যবস্থা যা নিয়মিত দেশের মানুষের পুষ্টির খোঁজখবর রাখে। এর কাজ হলো তথ্য সংগ্রহ করা এবং সেই তথ্যের ভিত্তিতে সরকারকে পলিসি বা নিয়ম বানাতে সাহায্য করা। এটি পুষ্টিহীনতা বাড়লে সতর্কবার্তা (Warning System) দেয়।<br><br><b>First Principles Thinking:</b><br>রোগ হওয়ার পর চিকিৎসা করার চেয়ে রোগ হওয়ার আগে জানা ভালো &#8594; সার্ভিলেন্স সিস্টেম নিয়মিত চেক করে &#8594; কোথাও সমস্যা দেখলে সরকারকে জানায় &#8594; সরকার তখন ব্যবস্থা নেয়।<br><br><b>Analogy (Bizarreness Effect):</b><br>এটি দেশের ""ড্যাশবোর্ড"" বা গাড়ির মিটারের মতো। গাড়ির তেল কমলে যেমন লাল বাতি জ্বলে, তেমনি দেশে পুষ্টি কমলে এই সিস্টেম সরকারকে লাল বাতি (Warning) দেখায়।<br><br><b>Example:</b><br>দেশে চালের দাম বাড়লে গরিবরা কম খাবে—এই তথ্য সার্ভিলেন্স সিস্টেম সরকারকে দেয় যাতে সরকার চালের দাম কমায়।<br><br><b>See–Link–Animate:</b><br>একটি বড় কন্ট্রোল রুমে অনেক স্ক্রিন আছে, যেখানে দেশের বিভিন্ন এলাকার পুষ্টির গ্রাফ ওঠানামা করছে।"
"<b>Topic: জরুরি অবস্থায় নজরদারি (Surveillance in Emergency Settings)</b><br><br><b>Probable Exam Questions [2-5 Marks]:</b><br>1. <b>What:</b> What is the role of surveillance as a ""Warning System""?<br>2. <b>How:</b> How does trend analysis trigger a response?<br>3. <b>Why:</b> Why is targeting specific areas important in emergencies?","<b>সহজ ব্যাখ্যা (Simple Explanation):</b><br>বন্যা বা যুদ্ধের মতো জরুরি অবস্থায় এই সিস্টেম ""সতর্ক ঘণ্টা"" হিসেবে কাজ করে। এটি বলে দেয় কোথায় খাবারের অভাব সবচেয়ে বেশি এবং কাদের সাহায্য আগে দরকার (Targeting)। এটি অপুষ্টির হার দেখে বুঝতে পারে পরিস্থিতি খারাপ হচ্ছে কিনা।<br><br><b>First Principles Thinking:</b><br>রিসোর্স বা সাহায্য সীমিত &#8594; সবার সাহায্য দরকার নেই &#8594; তাই যাদের অবস্থা সবচেয়ে খারাপ, তাদের খুঁজে বের করতে (Targeting) এই সিস্টেম ব্যবহার করা হয়।<br><br><b>Analogy (Bizarreness Effect):</b><br>জরুরি অবস্থায় সার্ভিলেন্স হলো ""লাইফবোট"" পাঠানোর মতো। জাহাজ ডুবছে, কিন্তু সবার আগে কাকে বাঁচাতে হবে? সার্ভিলেন্স সিস্টেম বলে দেয় ""ঐ কোণায় বাচ্চারা আছে, আগে ওখানে বোট পাঠাও""।<br><br><b>Example:</b><br>রোহিঙ্গা ক্যাম্পে শিশুদের ওজন কমে যাচ্ছে দেখে সার্ভিলেন্স সিস্টেম দ্রুত পুষ্টিকর খাবার পাঠানোর সংকেত দেয়।<br><br><b>See–Link–Animate:</b><br>ম্যাপের ওপর একটি লাল এলাকা দপদপ করছে (Blinking Red Light), আর ত্রাণকর্মীরা সেই দিকেই ট্রাক নিয়ে ছুটছে।"
"<b>Topic: প্রাথমিক বনাম মাধ্যমিক তথ্য (Primary vs. Secondary Data)</b><br><br><b>Probable Exam Questions [2-5 Marks]:</b><br>1. <b>Distinguish:</b> Difference between Primary and Secondary data sources.<br>2. <b>Why:</b> Why is continuous collection of primary data difficult?<br>3. <b>Example:</b> Give examples of secondary data sources for nutrition surveillance.","<b>সহজ ব্যাখ্যা (Simple Explanation):</b><br><b>Primary Data:</b> যা সরাসরি সার্ভে করে পাওয়া যায় (যেমন: ন্যাশনাল নিউট্রিশন সার্ভে)। এটি খুব ব্যয়বহুল।<br><b>Secondary Data:</b> যা অন্য কোনো কাজের জন্য সংগ্রহ করা হয়েছিল কিন্তু পুষ্টির কাজেও লাগে (যেমন: বাজার দর, হাসপাতালের রেকর্ড)। এটি সহজলভ্য ও সস্তা।<br><br><b>First Principles Thinking:</b><br>নিজেরা তথ্য জোগাড় করা (Primary) কঠিন ও দামী &#8594; তাই অন্যের জোগাড় করা তথ্য (Secondary) ব্যবহার করা বুদ্ধিমানের কাজ, যদি তা প্রাসঙ্গিক হয়।<br><br><b>Analogy (Bizarreness Effect):</b><br>Primary Data হলো ""নিজেই মাছ ধরা"" (কষ্টকর)। আর Secondary Data হলো ""বাজার থেকে মাছ কেনা"" (সহজ)। দুটোই খাওয়া যায়, কিন্তু সোর্স আলাদা।<br><br><b>Example:</b><br>স্বাস্থ্য মন্ত্রণালয়ের নিয়মিত রিপোর্ট বা হাউজহোল্ড বাজেট সার্ভে হলো সেকেন্ডারি ডাটা।<br><br><b>See–Link–Animate:</b><br>একজন গবেষক মাঠে গিয়ে মানুষের ওজন মাপছেন (Primary), আর অন্যজন অফিসে বসে পুরনো ফাইলের ধুলো ঝেড়ে তথ্য বের করছেন (Secondary)।"
"<b>Topic: স্টেকহোল্ডার (Stakeholders of Surveillance Data)</b><br><br><b>Probable Exam Questions [2-5 Marks]:</b><br>1. <b>List:</b> Who are the major stakeholders of nutrition surveillance data?<br>2. <b>What:</b> How does the Food Industry use this data?<br>3. <b>Why:</b> Why do Academic Institutions need surveillance data?","<b>সহজ ব্যাখ্যা (Simple Explanation):</b><br>যারা এই পুষ্টির তথ্য ব্যবহার করে, তারাই স্টেকহোল্ডার। সরকার (পলিসি বানাতে), এনজিও (সাহায্য করতে), ফুড ইন্ডাস্ট্রি (লেবেলিং ও মার্কেটিং করতে) এবং গবেষকরা (গবেষণা করতে) এই তথ্য ব্যবহার করে। সাধারণ মানুষও সচেতন হতে এই তথ্য চায়।<br><br><b>First Principles Thinking:</b><br>তথ্য শুধু জমিয়ে রাখলে লাভ নেই &#8594; এটি ব্যবহার করতে হবে &#8594; সরকার নিয়ম বানাবে, কোম্পানি খাবার বানাবে, এনজিও সাহায্য করবে &#8594; সবাই মিলে সমস্যার সমাধান করবে।<br><br><b>Analogy (Bizarreness Effect):</b><br>সার্ভিলেন্স ডাটা হলো ""খবরের কাগজ""। সরকার এটি পড়ে দেশ চালায়, ব্যবসায়ী পড়ে দাম ঠিক করে, আর ছাত্ররা পড়ে জ্ঞান বাড়ায়। সবাই একই কাগজ পড়ে ভিন্ন ভিন্ন কাজ করে।<br><br><b>Example:</b><br>ফুড ইন্ডাস্ট্রি সার্ভে ডাটা দেখে বুঝতে পারে মানুষের কোন ভিটামিনের অভাব, তাই তারা সেই ভিটামিন যুক্ত খাবার বাজারে আনে।<br><br><b>See–Link–Animate:</b><br>একটি গোল টেবিলে মন্ত্রী, বিজ্ঞানী, ব্যবসায়ী এবং এনজিও কর্মী বসে আছেন, সবার হাতে একই রিপোর্ট, কিন্তু সবাই আলাদা আলাদা প্ল্যান করছেন।"