"front","back"
"এনিমেশন কি একক মিডিয়া হিসেবে ব্যবহৃত হয়?","না, এর সাথে অডিও, ভিডিও, টেক্সট, গ্রাফিক্স ইত্যাদির সম্পর্ক রয়েছে।"
"সাউন্ড ইঞ্জিনিয়ারিং-এ কোন পদ্ধতি এখন অচল?","এনালগ পদ্ধতি"
"ব্যবহারকারীর সাথে কম্পিউটারের মিথস্ক্রিয়া সম্ভব এমন কিছুকে কী বলে?","ইন্টারঅ্যাকটিভিটি"
"শিক্ষার উপকরণ হিসেবে মাল্টিমিডিয়ার ব্যবহারে কী সুবিধা হয়?","শিক্ষার্থী সহজে বিষয়টি বুঝতে পারে"
"কয়েকটি বাংলাদেশি মাল্টিমিডিয়া সফটওয়্যারের নাম লিখুন।","বাংলাদেশ-৭১, অবসর, বিশ্বকোষ, নামাজ শিক্ষা, বিজয় শিশু শিক্ষা"
"একুশ শতককে কীসের শতক বলা হচ্ছে?","ডিজিটাল প্রকাশনার শতক"
"বিনোদনের ক্ষেত্রে মাল্টিমিডিয়ার ব্যবহার কোথায় হয়?","সিনেমায় স্পেশাল ইফেক্ট তৈরিতে"
"গেমসে মাল্টিমিডিয়া ব্যবহারের ফলে কীসের ছোঁয়া পেতে শুরু করেছে?","প্রকৃত বাস্তবতা (Reality)"
"যারা টেক্সট, গ্রাফিক্স, অডিও, ভিডিও, এনিমেশন নিয়ে কাজ করেন তাদের কী বলে?","মাল্টিমিডিয়া কনটেন্টস ডেভেলপার"
"কনটেন্টস ডেভেলপ করার জন্য ব্যবহৃত হয় এমন সফটওয়্যারের উদাহরণ দিন।","এডোবি ফটোশপ, থ্রিডি স্টুডিয়ো ম্যাক্স, মায়া"
"ইন্টারঅ্যাকটিভ অ্যাপ্লিকেশন তৈরির সফটওয়্যারকে কী বলে?","অথরিং সফটওয়্যার (যেমন: ডিরেক্টর)"
"front","back"
"কম্পিউটারের সাহায্যে ছবি সম্পাদনা করার জন্য ছবি কী করে কম্পিউটারে আনতে হয়?","স্ক্যান করে, অথবা ডিজিটাল ক্যামেরায় তুলে কপি করে"
"ছবি সম্পাদনার পর সেগুলো কী কাজে ব্যবহার করা যায়?","ডিজিটাল মাধ্যমে এবং কাগজে ছাপার জন্য (আমন্ত্রণপত্র, পোস্টার, ব্যানার, বিজ্ঞাপন)"
"বিশ্বব্যাপী জনপ্রিয় ছবি সম্পাদনার প্রোগ্রাম কোনটি?","এডোবি ফটোশপ (Adobe Photoshop)"
"ফটোশপ দিয়ে করা যায় এমন কয়েকটি কাজের উদাহরণ দিন।","ছবির ঔজ্জ্বল্য বাড়ানো-কমানো, একাধিক ছবির সমন্বয়ে প্রচ্ছদ বা পোস্টার তৈরি, ছবির অপ্রয়োজনীয় অংশ কেটে ফেলা, ছবির দাগ বা ত্রুটি মুছে ফেলা"
"ফটোশপ খোলার পদ্ধতি কী?","Start > All Programs > Adobe Photoshop"
"ফটোশপে নতুন ফাইল তৈরি করার জন্য কোন মেনুতে যেতে হয়?","File > New"
"New ডায়ালগ বক্সে ফাইলের নাম কোন ঘরে টাইপ করতে হয়?","Name ঘরে"
"ফাইলের প্রশস্ততা বা উচ্চতা কোন ঘরে নির্ধারণ করতে হয়?","Width এবং Height"
"পরিমাপের একক (যেমন ইঞ্চি বা পিক্সেল) কোথায় সিলেক্ট করতে হয়?","Width বা Height ঘরের ডান পাশের ড্রপ-ডাউন মেনু থেকে"
"ফটোশপে ইমেজ বা ছবি কী দিয়ে তৈরি হয়?","পিক্সেল (Pixel)"
"পিক্সেল কী?","একটি ইমেজ বা ছবির বর্গাকার ক্ষুদ্রতম একক"
"রেজুলিউশন (Resolution) কী?","প্রতি বর্গ ইঞ্চিতে বা নির্দিষ্ট এককে পিক্সেলের পরিমাণ"
"একটি ছবি বেশি বড়ো করলে পিক্সেলগুলো দেখা যাওয়াকে কী বলে?","পিক্সেলেটেড (Pixelelated) হয়ে যাওয়া"
"ছবি 'ফেটে যাওয়া' কথাটির প্রযুক্তিগত পরিভাষা কী?","পিক্সেলেটেড (Pixelelated) হয়ে যাওয়া"
"কম্পিউটার বা টিভির মনিটরে প্রদর্শিত বিষয়ের জন্য কোন কালার মোড ব্যবহৃত হয়?","RGB মোড"
"RGB-এর পূর্ণরূপ কী?","Red, Green এবং Blue (লাল, সবুজ এবং নীল)"
"মুদ্রণের জন্য ব্যবহৃত হয় এমন একটি কালার মোডের নাম কী?","CMYK"
"Background Contents-এর ৩টি অপশন কী কী?","White (সাদা), Background Color এবং Transparent (স্বচ্ছ)"
"Transparent বা স্বচ্ছ ব্যাকগ্রাউন্ড দেখতে কেমন হয়?","রংবিহীন চেকবিশিষ্ট"
"ফটোশপে কাজ করার পর্দাটিকে শিল্পীর কিসের সাথে তুলনা করা হয়?","ক্যানভাস (Canvas)"
"ফটোশপ উইন্ডোর বাম পাশে কী থাকে?","টুল বক্স"
"ফটোশপ উইন্ডোর ডান পাশে কী থাকে?","প্যালেট (Palette)"
"টুল বক্সে তুলির রং বা ক্যানভাসের রং নিয়ন্ত্রণের আইকনকে কী বলে?","Foreground এবং Background কালার আইকন"
"পেন্সিল বা ব্রাশ টুল কোন রং ব্যবহার করে?","Foreground-এর রং"
"প্যালেটকে ছোট বা 'গুটিয়ে' ফেলার জন্য কোন আইকনে ক্লিক করতে হয়?","মিনিমাইজ (Minimize) আইকন (বিয়োগ চিহ্ন)"
"টুল বক্সে কিছু টুলের নিচের ডান দিকে ছোটো তীর চিহ্নের অর্থ কী?","ওই টুলের একই অবস্থানে একই গোত্রের আরও টুল রয়েছে"
"চতুষ্কোণ ও বৃত্তাকার সিলেকশন তৈরির জন্য কোন টুল ব্যবহৃত হয়?","মার্কি টুল (Marquee Tool)"
"নিখুঁত বর্গ সিলেকশন তৈরির জন্য কোন বোতাম চেপে ড্র্যাগ করতে হয়?","Shift বোতাম (Rectangular Marquee Tool দিয়ে)"
"নিখুঁত বৃত্ত সিলেকশন তৈরির জন্য কোন বোতাম চেপে ড্র্যাগ করতে হয়?","Shift বোতাম (Elliptical Marquee Tool দিয়ে)"
"কেন্দ্রবিন্দু থেকে সিলেকশন তৈরির জন্য কোন বোতাম চেপে ড্র্যাগ করতে হয়?","Alt বোতাম"
"ভাসমান সিলেকশন (শুধু রেখা) সরানোর জন্য মাউস পয়েন্টার কোথায় নিয়ে ড্র্যাগ করতে হয়?","সিলেকশনের ভেতরে"
"সিলেকশন বাতিল করার দুটি উপায় কী?","Select মেনু থেকে Deselect কমান্ড দেওয়া, অথবা সিলেকশনের বাইরে ক্লিক করা"
"সিলেকশনকে Foreground (তুলির) রং দিয়ে পূরণ করার কীবোর্ড শর্টকাট কী?","Alt + Backspace"
"সিলেকশনকে Background (ক্যানভাসের) রং দিয়ে পূরণ করার কীবোর্ড শর্টকাট কী?","Ctrl + Backspace (অথবা শুধু Backspace)"
"রং দিয়ে পূরণ করা অবজেক্টকে 'কাট' (Cut) করে সরাতে কীবোর্ডের কোন বোতাম চেপে ড্র্যাগ করতে হয়?","Ctrl বোতাম"
"রং দিয়ে পূরণ করা অবজেক্টকে 'কপি' (Copy) করে সরাতে কীবোর্ডের কোন বোতাম চেপে ড্র্যাগ করতে হয়?","Ctrl ও Alt বোতাম একসঙ্গে"
"অবজেক্টের প্রান্ত নমনীয় করার জন্য অপশন বারের কোন ঘরে সংখ্যা টাইপ করতে হয়?","ফেদার (Feather)"
"ফেদার ঘরে ১০ টাইপ করলে প্রান্তের নমনীয়তা মোট কত পিক্সেল হয়?","২০ পিক্সেল (ভেতর ও বাইরে)"
"মুক্তভাবে আঁকাবাঁকা সিলেকশন তৈরির জন্য কোন টুল ব্যবহৃত হয়?","ল্যাসো টুল (Lasso Tool)"
"ল্যাসো টুল দিয়ে আঁকার সময় মাউস ছেড়ে দিলে কী ঘটে?","যে অবস্থান থেকে শুরু করা হয়েছিল, বর্তমান অবস্থানের সাথে রেখা তৈরি হয়ে সিলেকশন বদ্ধ হয়"
"রঙের গাঢ়ত্বের পরিমাণ নির্ধারণ করার জন্য কী ব্যবহার করা হয়?","ওপাসিটি (Opacity)"
"সিলেকশনের বর্ডার বা প্রান্তরেখা তৈরি করার জন্য Edit মেনুর কোন কমান্ডটি ব্যবহৃত হয়?","স্ট্রোক (Stroke)"
"স্ট্রোক ডায়ালগ বক্সে বর্ডারের প্রশস্ততা কোন ঘরে নির্ধারণ করা হয়?","Stroke Width (১ থেকে ১৬ পর্যন্ত)"
"স্ট্রোক বর্ডারটি সিলেকশনের কোন কোন অবস্থানে তৈরি করা যায়?","Outside (বাইরে), Inside (ভেতরে) বা Center (মাঝামাঝি)"
"স্ট্রোক কমান্ডটি কোন রং ব্যবহার করে?","তুলির রং বা ফোরগ্রাউন্ডের রং"
"ফটোশপে ছবি সম্পাদনার পর্দার একেকটি স্তরকে কী বলে?","লেয়ার (Layer)"
"লেয়ার পদ্ধতিকে কিসের সাথে তুলনা করা যায়?","একাধিক স্বচ্ছ ক্যানভাস বা কাচ একটির উপর একটি রাখা"
"রঙিন ছবি খুললে লেয়ার প্যালেটে সেটি কী হিসেবে থাকে?","Background"
"Background লেয়ারের ডান দিকে তালার আইকন থাকার অর্থ কী?","লেয়ারটি লক করা আছে"
"লক করা লেয়ারে কোন টুল দিয়ে অবজেক্ট সরানো যায় না?","মুভ টুল (Move Tool)"
"Background লেয়ারকে সাধারণ লেয়ারে (Layer 0) পরিণত করার উপায় কী?","লেয়ার প্যালেটে Background-এর উপর ডাবলক্লিক করা"
"কোন টুল দিয়ে Background লেয়ারে ক্লিক করলে তা আপনাআপনি Layer 0-তে পরিণত হয়?","Background Eraser টুল"
"নতুন লেয়ার যুক্ত করার জন্য লেয়ার প্যালেটের নিচের কোন আইকনে ক্লিক করতে হয়?","Create a new layer আইকন"
"নতুন লেয়ারটি কোন লেয়ারের উপরে যুক্ত হয়?","সিলেক্ট করা লেয়ারটির উপরে"
"নতুন যুক্ত হওয়া লেয়ারটি কেমন হয়?","স্বচ্ছ (Transparent)"
"লেয়ারের স্তর বিন্যাস (ওপর-নিচ) পরিবর্তন করার উপায় কী?","লেয়ার প্যালেটে লেয়ারটিতে ক্লিক করে ড্র্যাগ করে ওপর-নিচ করা"
"কোন লেয়ারকে সরানো যায় না (যদি না লেয়ারে পরিণত করা হয়)?","ব্যাকগ্রাউন্ড লেয়ার"
"কোনো লেয়ারের ছবিকে অদৃশ্য করার জন্য কোন আইকনে ক্লিক করতে হয়?","চোখের আইকন (লেয়ার ভিজিবিলিটি আইকন)"
"লেয়ার প্যালেটে বড়ো ছবির ক্ষুদ্র সংস্করণকে কী বলে?","থাম্বনেইল আইকন (Thumbnail Icon)"
"একাধিক প্যালেট যখন একটি উইন্ডোতে ট্যাব আকারে থাকে, তাকে কী বলে?","গুচ্ছ প্যালেট (Clustered Palette)"
"পর্দায় লেয়ার প্যালেট না থাকলে কোন মেনু থেকে তা আনতে হয়?","Window মেনু থেকে Layers কমান্ড"
"টাইপ টুলের সাহায্যে টাইপ করলে লেখাটি কোথায় তৈরি হয়?","আপনাআপনি নতুন Text লেয়ারে"
"নতুন Text লেয়ারের থাম্বনেইল আইকনটি কেমন দেখায়?","T বর্ণ (ইংরেজি টি)"
"এক ফাইলের ছবি অন্য ফাইলে স্থানান্তরিত করার উপায় কী?","মুভ টুল দিয়ে ছবিটি ড্র্যাগ করে অন্য ফাইলের উইন্ডোর ভেতরে ছেড়ে দেওয়া"
"যে লেয়ারে বর্তমানে কাজ করা হয়, সেই লেয়ারকে কী বলে?","টার্গেট লেয়ার (Target Layer)"
"লেয়ারের ওপাসিটি (Opacity) পরিবর্তন করার উপায় কী?","Opacity টেক্সট বক্সে সংখ্যা টাইপ করা, অথবা Opacity লেখার উপর মাউস রেখে ড্র্যাগ করা"
"লেয়ার বাতিল করার জন্য লেয়ারটি সিলেক্ট করে প্যালেটের নিচে কোন আইকনে ক্লিক করতে হয়?","Delete Layer আইকন (ডিলিট আইকন)"
"অনেকগুলো লেয়ার একীভূত (Merge) করলে ফাইলের কী সুবিধা হয়?","ফাইলের আকার অপেক্ষাকৃত ছোটো হয়"
"শুধু দৃশ্যমান লেয়ারগুলো একীভূত করার কমান্ড কোনটি?","Merge Visible"
"সিলেক্ট করা লেয়ার এবং ঠিক তার নিচের লেয়ার একীভূত করার কমান্ড কোনটি?","Merge Down"
"সবগুলো লেয়ার একীভূত করার কমান্ড কোনটি?","Flatten Image"
"Flatten Image কমান্ড দেওয়ার সময় কোনো লেয়ার অদৃশ্য থাকলে কী ঘটে?","একটি সতর্ক বার্তা আসে যে অদৃশ্য লেয়ারটি বাতিল হবে কি-না"
"পেস্ট (Paste) করলে কাট বা কপি করা অবজেক্ট কোথায় পেস্ট হয়?","আপনাআপনি নতুন লেয়ার তৈরি হয়ে সেখানে পেস্ট হয় (যদি না একটি স্বচ্ছ লেয়ার আগে তৈরি করা থাকে)"
"ছবির অপ্রয়োজনীয় অংশ বা এবড়োথেবড়ো প্রান্ত ছেঁটে ফেলার জন্য কোন টুল ব্যবহৃত হয়?","ক্রপ টুল (Crop Tool)"
"ক্রপ সিলেকশন চূড়ান্ত করার জন্য কীবোর্ডের কোন বোতামে চাপ দিতে হয়?","Enter বোতাম"
"ক্রপ করার কাজ বাতিল করার জন্য কীবোর্ডের কোন বোতামে চাপ দিতে হয়?","Esc বোতাম"
"হেলানো ছবিকে স্বয়ংক্রিয়ভাবে সোজা ও ক্রপ করার কমান্ড কী?","File > Automate > Crop and Straighten Photos"
"স্বয়ংক্রিয় ক্রপ ও সোজা করার পদ্ধতির সীমাবদ্ধতা কী?","এটি শুধু এক রঙের সলিড ব্যাকগ্রাউন্ডের ক্ষেত্রে প্রযোজ্য"
"ইরেজার টুল দিয়ে Background লেয়ারে মুছলে কোন রং দেখা যায়?","ক্যানভাসের রং (Background Color)"
"ইরেজার টুল দিয়ে স্বচ্ছ লেয়ারে মুছলে কী দেখা যায়?","স্বচ্ছ (Transparent)"
"সূক্ষ্ম অংশ মোছার জন্য ইরেজার টুলকে যোগ চিহ্নে (+) পরিণত করতে কীবোর্ডের কোন বোতাম চাপতে হয়?","CAPS LOCK"
"একটি রং শুরু থেকে শেষের দিকে ক্রমে মিলিয়ে যাওয়াকে কী বলে?","ব্লেন্ড (Blend)"
"গ্রেডিয়েন্ট টুলের ৫ প্রকার গ্রেডিয়েন্টের নাম কী?","Linear, Radial, Angle, Reflected এবং Diamond"
"লিনিয়ার ব্লেন্ড (Linear Blend) কী?","রং এক প্রান্ত থেকে অন্য প্রান্তে পৌঁছাতে পৌঁছাতে ক্রমান্বয়ে মিলিয়ে যায়"
"রেডিয়াল ব্লেন্ড (Radial Blend) কী?","রং শুরুর স্থান থেকে চতুর্দিকে বিস্তৃত হয়ে ক্রমান্বয়ে মিলিয়ে যায়"
"গ্রেডিয়েন্ট টুল সিলেক্ট থাকা অবস্থায় ক্যানভাসে মাউস কী রূপ ধারণ করে?","যোগ চিহ্ন (+)"
"ক্যানভাসে কোনো কিছু সিলেক্ট করা না থাকলে গ্রেডিয়েন্ট টুল কোথায় ব্লেন্ড তৈরি করে?","সম্পূর্ণ পর্দা জুড়ে"
"গ্রেডিয়েন্ট সম্পাদনা করার জন্য কোন ডায়ালগ বক্স খুলতে হয়?","Gradient Editor"
"Gradient Editor খোলার উপায় কী?","অপশন বারে গ্রেডিয়েন্ট বার-এ ক্লিক করা"
"গ্রেডিয়েন্ট এডিটরে স্লাইডারের নিচে ত্রিকোণগুলোকে কী বলে?","Color Stop (কালার স্টপ)"
"গ্রেডিয়েন্ট এডিটরে স্লাইডারের উপরে ত্রিকোণগুলোকে কী বলে?","Opacity Stop (ওপাসিটি স্টপ)"
"গ্রেডিয়েন্ট স্লাইডারে নতুন কালার স্টপ যোগ করার উপায় কী?","স্লাইডারের নিচে যেকোনো জায়গায় ক্লিক করা"
"গ্রেডিয়েন্ট স্লাইডার থেকে কালার স্টপ বাতিল করার উপায় কী?","সংশ্লিষ্ট কালার স্টপ আইকনে ক্লিক ও ট্র্যাগ করে স্লাইডারের বাইরে এনে ছেড়ে দেওয়া"
"ছবির ঔজ্জ্বল্য (Brightness) ও কনট্রাস্ট (Contrast) সমন্বয় করার কমান্ড কী?","Image > Adjustments > Brightness/Contrast"
"Brightness/Contrast ডায়ালগ বক্সে পরিবর্তনগুলো তাৎক্ষণিকভাবে দেখার জন্য কোন চেক বক্স চালু রাখতে হয়?","Preview চেক বক্স"
"যেকোনো Adjustments ডায়ালগ বক্সে করা পরিবর্তন বাতিল করে আগের অবস্থায় ফেরার জন্য কোন বোতাম চাপতে হয়?","Alt বোতাম চেপে রাখলে Cancel বোতামটি Reset বোতামে পরিণত হবে, সেই Reset বোতামে ক্লিক করতে হবে"
front,back
"বর্তমান সময়কে কিসের যুগ বলা হয়?","তথ্য বিনিময় এবং তথ্যের প্রবাহ অবারিত করে মানবতার কল্যাণ নিশ্চিত করার যুগ"
"সভা, সেমিনার-সিম্পোজিয়াম ইত্যাদির আয়োজনের উদ্দেশ্য কী?","সকল প্রকার তথ্যের ভান্ডার সকলের জন্য সহজলভ্য করা"
"সভা বা সেমিনারে তথ্য উপস্থাপন করার জন্য প্রধানত কোন সফটওয়্যার ব্যবহার করা হয়?","প্রেজেন্টেশন সফটওয়্যার"
"পাওয়ার পয়েন্ট ছাড়া অন্য দুটি প্রেজেন্টেশন সফটওয়্যারের নাম কী?","পিকাসা, ইমপ্রেস"
"পাওয়ার পয়েন্ট কোন কোম্পানির সফটওয়্যার?","মাইক্রোসফট"
"পাওয়ার পয়েন্ট সফটওয়্যারটিকে আর কী বলা হয়?","প্রেজেন্টেশন সফটওয়্যার"
"পাওয়ার পয়েন্টের সাহায্যে কী কী সমন্বয়ে তথ্যাদি উপস্থাপন করা যায়?","লেখা, ছবি, অডিয়ো, ভিডিয়ো, গ্রাফ ইত্যাদি"
"পাওয়ার পয়েন্টে ফাইলকে কী নামে অভিহিত করা হয়?","প্রেজেন্টেশন"
"একটি প্রেজেন্টেশনে একাধিক কী থাকে?","স্লাইড (slide)"
"প্রেজেন্টেশনের এক একটি অংশকে কী বলা হয়?","স্লাইড (slide)"
